[
{
    "name": "The Thing",
    "alienValidated": false,
    "creators": "John Carpenter, Bill Lancaster",
    "summary": "A shape-shifting extraterrestrial organism that infiltrates an Antarctic research station, mimicking its human hosts and creating paranoia and terror among the survivors.",
    "imgOverview": "./images/TheThing-0.png"
}
]